{
  "$schema": "http://json-schema.org/draft-07/schema#",
  "title": "TC-026 PFS2 KM Median Output Schema",
  "type": "object",
  "required": ["test_case_id", "endpoint", "population", "arm_control", "arm_experimental", "language", "version"],
  "properties": {
    "test_case_id": {"type": "string", "const": "TC-026"},
    "endpoint": {"type": "string", "const": "Progression-Free Survival 2"},
    "population": {"type": "string", "const": "ITT"},
    "arm_control": {
      "type": "object",
      "required": ["median_pfs2", "median_ci_lower", "median_ci_upper", "n_events", "n_total", "event_rate", "hazard_ratio", "logrank_p", "arm", "population"]
    },
    "arm_experimental": {
      "type": "object",
      "required": ["median_pfs2", "median_ci_lower", "median_ci_upper", "n_events", "n_total", "event_rate", "hazard_ratio", "logrank_p", "arm", "population"]
    },
    "subgroups": {
      "type": "array",
      "items": {
        "type": "object",
        "required": ["variable", "level", "median_exp", "median_ctrl", "n_exp", "n_ctrl", "hr"]
      }
    },
    "censoring_summary": {
      "type": "object",
      "required": ["n_censored", "n_events", "censoring_rate"]
    },
    "language": {"type": "string"},
    "version": {"type": "string"}
  }
}
