{
  "test_case_id": "TC-026",
  "endpoint": "Progression-Free Survival 2",
  "population": "ITT",
  "arm_control": {
    "median_pfs2": 14.76,
    "median_ci_lower": 0.0,
    "median_ci_upper": 0.0,
    "n_events": 73,
    "n_total": 82,
    "event_rate": 0.8902,
    "logrank_chisq": 22.8886,
    "logrank_p": 2e-06,
    "hazard_ratio": 0.4446,
    "hr_ci_lower": 0.3163,
    "hr_ci_upper": 0.6248,
    "arm": 0,
    "population": "ITT"
  },
  "arm_experimental": {
    "median_pfs2": 21.28,
    "median_ci_lower": 0.0,
    "median_ci_upper": 0.0,
    "n_events": 79,
    "n_total": 107,
    "event_rate": 0.7383,
    "logrank_chisq": 22.8886,
    "logrank_p": 2e-06,
    "hazard_ratio": 0.4446,
    "hr_ci_lower": 0.3163,
    "hr_ci_upper": 0.6248,
    "arm": 1,
    "population": "ITT"
  },
  "subgroups": [
    {
      "variable": "SEX",
      "level": "F",
      "median_exp": 17.52,
      "median_ctrl": 15.15,
      "n_exp": 42,
      "n_ctrl": 35,
      "hr": 0.6718
    },
    {
      "variable": "SEX",
      "level": "M",
      "median_exp": 27.23,
      "median_ctrl": 14.0,
      "n_exp": 65,
      "n_ctrl": 47,
      "hr": 0.3585
    },
    {
      "variable": "AGEGR1",
      "level": "<65",
      "median_exp": 20.73,
      "median_ctrl": 14.16,
      "n_exp": 79,
      "n_ctrl": 57,
      "hr": 0.481
    },
    {
      "variable": "AGEGR1",
      "level": ">=65",
      "median_exp": 23.96,
      "median_ctrl": 15.28,
      "n_exp": 28,
      "n_ctrl": 25,
      "hr": 0.3752
    },
    {
      "variable": "ECOG",
      "level": "0",
      "median_exp": 19.51,
      "median_ctrl": 14.76,
      "n_exp": 58,
      "n_ctrl": 45,
      "hr": 0.4365
    },
    {
      "variable": "ECOG",
      "level": "1",
      "median_exp": 24.78,
      "median_ctrl": 15.78,
      "n_exp": 49,
      "n_ctrl": 37,
      "hr": 0.4471
    }
  ],
  "censoring_summary": {
    "n_censored": 37,
    "n_events": 152,
    "censoring_rate": 0.1958
  },
  "language": "Python",
  "version": "1.0"
}